{
  "schema_version": "1",
  "package": "tailtrail",
  "required_files": [
    ".github/prompts/tailtrail-start.prompt.md",
    "AGENTS.md",
    "AIDLC.md",
    "ARCHITECTURE.md",
    "ASSISTANT-COMPATIBILITY.md",
    "CLAUDE.md",
    "COMPLETE-END-TO-END-WORKFLOW.md",
    "DEPENDENCY-GATE.md",
    "EVALUATION-HARNESS.md",
    "GOVERNANCE.md",
    "GUARDRAILS.md",
    "HOST-ADAPTERS.md",
    "INSTALL.md",
    "INSTALLER-LIFECYCLE.md",
    "MCP-SERVER.md",
    "NAVIGATOR-FALSE-STOP-REMEDIATION-PLAN.md",
    "PACKAGE-CONTRACT.md",
    "PRODUCT-MATURITY-IMPROVEMENT-PLAN.md",
    "TAILTRAIL-STOP-RESUME-CONTROL-IMPLEMENTATION-PLAN.md",
    "REPOSITORY-ENFORCEMENT.md",
    "platform-release-contract.json",
    "PUBLIC-CLAIMS.md",
    "README.md",
    "ROADMAP.md",
    "SECURITY.md",
    "SUPPORT.md",
    "SUPPLY-CHAIN.md",
    "TAILTRAIL-COMMANDS.md",
    "USER-GUIDE.md",
    "VERSIONING.md",
    "enterprise-closure-registry.json",
    "enterprise-closure-registry.schema.json",
    "package-manifest.json",
    "package-manifest.schema.json",
    "pyproject.toml",
    "release-manifest.json",
    "release-manifest.schema.json",
    "release-build-lock.json",
    "release-channel-v1.json",
    "tailtrail-policy.example.md",
    "tailtrail-enforcement-baseline.json",
    "tailtrail-enforcement-policy.json",
    "tailtrail-enforcement-suppressions.json",
    "tailtrail-registry.json",
    "tailtrail-registry.schema.json",
    "tailtrail-meta/product-maturity-baseline-v1.json",
    "tailtrail-meta/product-maturity-policy-v1.json",
    "tailtrail-meta/product-maturity-learning-inventory-v1.json",
    "tailtrail-meta/document-owners-v1.json",
    "tailtrail-meta/maintainability-inventory-v1.json",
    "tailtrail-meta/navigator-scope-baseline-v1.json",
    "context/navigator.md",
    "context/code-graph-mapper.md",
    "schemas/navigator-scope-evidence.schema.json",
    "schemas/navigator-host-scope-proposal.schema.json",
    "schemas/navigator-scope-quality.schema.json",
    "schemas/host-scope-conformance.schema.json",
    "schemas/host-scope-reasoning-conformance.schema.json",
    "schemas/host-requirement-routing-conformance.schema.json",
    "schemas/navigator-scope-calibration-catalog.schema.json",
    "schemas/navigator-scope-calibration-report.schema.json",
    "schemas/navigator-scope-release-policy.schema.json",
    "schemas/navigator-scope-migration-report.schema.json",
    "schemas/navigator-scope-release-proof.schema.json",
    "schemas/navigator-installed-release-proof.schema.json",
    "schemas/navigator-graph-lifecycle.schema.json",
    "schemas/navigator-run-mapping-index.schema.json",
    "schemas/canonical-requirement-set.schema.json",
    "schemas/requirement-interpretation.schema.json",
    "schemas/requirement-evidence-assistance.schema.json",
    "schemas/requirement-intake.schema.json",
    "schemas/requirement-sufficiency.schema.json",
    "schemas/debug-host-diagnosis.schema.json",
    "schemas/debug-preflight.schema.json",
    "schemas/debug-reproduction-attempt.schema.json",
    "schemas/debug-reproduction-attempt-status.schema.json",
    "schemas/host-runtime-receipt.schema.json",
    "schemas/tailtrail-session-attachment.schema.json",
    "adapters/host-compatibility-v1.json",
    "adapters/runtime-scenarios-v1.json",
    "adapters/navigator-scope-scenarios-v2.json",
    "adapters/navigator-host-reasoning-scenarios-v1.json",
    "adapters/requirement-routing-scenarios-v1.json",
    "benchmarks/evaluation/navigator-scope/v1.json",
    "benchmarks/evaluation/navigator-scope/release-v1.json",
    "benchmarks/evaluation/navigator-scope/fsr6-v1.json",
    "benchmarks/evaluation/navigator-scope/language-profiles-v1.json",
    "benchmarks/evaluation/navigator-scope/installed-release-v1.json",
    "benchmarks/product-maturity/pm0-scenarios-v1.json",
    "benchmarks/product-maturity/pm-l2-retrieval-fixtures-v1.json",
    "benchmarks/product-maturity/presentation-v1/plan-report.json",
    "benchmarks/product-maturity/presentation-v1/debug-report.json",
    "benchmarks/product-maturity/presentation-v1/closure-report.json",
    "benchmarks/evaluation/learning-calibration/v1.json",
    "benchmarks/evaluation/real-portfolio/v1.json",
    "benchmarks/evaluation/adoption/v1.json",
    "benchmarks/enterprise-conformance/v1.json"
  ],
  "required_directories": [
    ".claude",
    ".codex-plugin",
    ".cursor",
    ".openai",
    "adapters",
    "aidlc",
    "aidlc-docs",
    "context",
    "docs",
    "examples",
    "hooks",
    "schemas",
    "scripts",
    "skills",
    "tailtrail",
    "templates"
  ],
  "excluded_names": [
    ".DS_Store",
    "__pycache__",
    "worktrees"
  ],
  "excluded_suffixes": [
    ".pyc",
    ".pyo"
  ],
  "runtime_required": [
    "AGENTS.md",
    "GUARDRAILS.md",
    "package-manifest.json",
    "schemas/planning-lock.schema.json",
    "schemas/debug-host-diagnosis.schema.json",
    "schemas/install-plan.schema.json",
    "schemas/install-ownership-manifest.schema.json",
    "schemas/install-journal-event.schema.json",
    "schemas/host-adapter-contract.schema.json",
    "schemas/platform-qualification-receipt.schema.json",
    "schemas/release-evidence.schema.json",
    "schemas/release-channel.schema.json",
    "schemas/release-publication-receipt.schema.json",
    "schemas/repository-enforcement-policy.schema.json",
    "schemas/repository-enforcement-report.schema.json",
    "schemas/repository-enforcement-suppression.schema.json",
    "scripts/__init__.py",
    "scripts/tailtrail.py",
    "scripts/session-control.py",
    "scripts/session_control.py",
    "scripts/installer.py",
    "tailtrail/__init__.py",
    "tailtrail/hosts/__init__.py",
    "tailtrail/hosts/contracts.py",
    "tailtrail/hosts/diagnostics.py",
    "tailtrail/install/__init__.py",
    "tailtrail/install/catalog.py",
    "tailtrail/install/cli.py",
    "tailtrail/install/engine.py",
    "tailtrail/install/host_launcher.py",
    "tailtrail/install/models.py",
    "tailtrail/upgrade.py",
    "tailtrail/__main__.py",
    "scripts/upgrade-tailtrail.py",
    "scripts/repository-enforcement.py",
    "scripts/release-info.py",
    "scripts/release-publication.py",
    "scripts/installation-qualification.py",
    "scripts/task-start.py",
    "scripts/requirement_evidence.py",
    "scripts/requirement_intake.py",
    "scripts/debug-host-diagnosis.py",
    "scripts/debug-preflight.py",
    "scripts/code_relationships.py",
    "scripts/navigator-scope.py",
    "scripts/navigator_scope.py",
    "scripts/module_resolution.py",
    "scripts/navigator_graph_lifecycle.py",
    "scripts/code-graph-mapper.py",
    "scripts/code_graph_inventory.py",
    "scripts/mcp-server.py",
    "scripts/host-adapter-conformance.py",
    "scripts/host-runtime-conformance.py",
    "scripts/run-tests.py",
    "scripts/architecture_planning.py",
    "scripts/behaviour_planning.py",
    "scripts/ui_planning.py",
    "scripts/maintainability_planning.py",
    "scripts/maintainability-harness.py",
    "scripts/planning_lock.py",
    "scripts/product-maturity.py",
    "scripts/learning-v3.py",
    "scripts/learning-retrieval.py",
    "scripts/learning-use-receipt.py",
    "scripts/learning-governance.py",
    "scripts/learning-calibration.py",
    "scripts/navigator-scope-calibration.py",
    "scripts/navigator-installed-release-proof.py",
    "scripts/navigator-scope-release.py",
    "scripts/product-maintainability.py",
    "scripts/enterprise-conformance.py",
    "scripts/real-evaluation-portfolio.py",
    "scripts/adoption-validation.py",
    "scripts/orchestration/__init__.py",
    "scripts/orchestration/run_resolution.py",
    "scripts/execution-evidence.py",
    "scripts/closure-finalizer.py",
    "scripts/task-recovery.py",
    "scripts/workflow-runtime.py",
    "scripts/orchestration_facade.py",
    "scripts/presentation.py",
    "tailtrail-registry.json",
    "schemas/product-maturity-baseline.schema.json",
    "schemas/product-maturity-learning-inventory.schema.json",
    "schemas/learning-v3-record.schema.json",
    "schemas/learning-use-proposal.schema.json",
    "schemas/learning-use-receipt-event.schema.json",
    "schemas/learning-governance-event.schema.json",
    "schemas/learning-calibration-catalog.schema.json",
    "schemas/learning-calibration-report.schema.json",
    "schemas/learning-calibration-projection.schema.json",
    "schemas/navigator-scope-calibration-catalog.schema.json",
    "schemas/navigator-scope-calibration-report.schema.json",
    "schemas/navigator-scope-release-policy.schema.json",
    "schemas/navigator-scope-migration-report.schema.json",
    "schemas/navigator-scope-release-proof.schema.json",
    "schemas/navigator-installed-release-proof.schema.json",
    "schemas/navigator-graph-lifecycle.schema.json",
    "schemas/navigator-run-mapping-index.schema.json",
    "schemas/canonical-requirement-set.schema.json",
    "schemas/requirement-interpretation.schema.json",
    "schemas/requirement-evidence-assistance.schema.json",
    "schemas/requirement-intake.schema.json",
    "schemas/requirement-sufficiency.schema.json",
    "schemas/workflow-stage-result.schema.json",
    "schemas/presentation-report.schema.json",
    "schemas/maintainability-inventory.schema.json",
    "schemas/real-evaluation-portfolio.schema.json",
    "schemas/enterprise-conformance-report.schema.json",
    "schemas/adoption-validation-catalog.schema.json",
    "schemas/adoption-validation-trial.schema.json",
    "schemas/adoption-validation-report.schema.json",
    "schemas/adoption-improvement-decision.schema.json",
    "schemas/navigator-scope-baseline.schema.json",
    "schemas/navigator-scope-evidence.schema.json",
    "schemas/navigator-host-scope-proposal.schema.json",
    "schemas/navigator-scope-quality.schema.json",
    "schemas/host-scope-conformance.schema.json",
    "schemas/host-scope-reasoning-conformance.schema.json",
    "schemas/host-requirement-routing-conformance.schema.json",